{
  "schema": "stratadiff-merge-readiness-audit-v1",
  "tool_version": "0.5.0",
  "generated_at": "2026-09-07T17:59:51Z",
  "scope": {
    "provider_url": "https://github.com",
    "repository": "dcoapp/app",
    "default_branch": "main",
    "default_branch_head_sha": "822df17d83077098d659f4f673b18deba5d7405e",
    "sampled_pull_requests": 1
  },
  "collection": {
    "status": "partial",
    "api_calls": 13,
    "response_bytes": 2483672,
    "gaps": [
      {
        "surface": "effective_rules",
        "reason": "GitHub marks the default branch protected, but classic branch protection was absent or unreadable"
      }
    ]
  },
  "privacy": {
    "repository_source_collected": false,
    "workflow_definitions_collected": true,
    "pull_request_text_collected": true,
    "check_run_output_text_collected": true,
    "commit_status_description_collected": true,
    "review_text_collected": false,
    "commit_messages_collected": true
  },
  "claim_boundary": {
    "current_configuration_snapshot_supported": true,
    "historical_configuration_at_merge_supported": false,
    "merge_safety_supported": false,
    "workflow_runtime_semantics_supported": false,
    "cost_savings_supported": false
  },
  "summary": {
    "verdict": "inconclusive",
    "findings": 0,
    "high_findings": 0,
    "medium_findings": 0,
    "unknowns": 2,
    "required_checks": 3,
    "sampled_pull_requests": 1,
    "fully_observed_pull_requests": 1
  },
  "findings": [],
  "unknowns": [
    {
      "code": "collection_incomplete",
      "context": null,
      "workflow_path": null,
      "reason": "One or more GitHub surfaces were not collected completely; absence of another finding is not a clean result.",
      "evidence": [
        {
          "kind": "repository",
          "url": "https://github.com/dcoapp/app",
          "description": "repository whose readiness snapshot is incomplete"
        }
      ]
    },
    {
      "code": "required_check_source_unresolved",
      "context": "Vercel",
      "workflow_path": null,
      "reason": "Pull request #332 exposes this context through evidence whose GitHub App identity is not available in the snapshot.",
      "evidence": [
        {
          "kind": "pull_request",
          "url": "https://github.com/dcoapp/app/pull/332",
          "description": "pull request #332 head 251ca52153f3700617c50001b0ccf53c4c3e19c6 has unresolved publisher identity for Vercel"
        }
      ]
    }
  ]
}
